{
  "$schema": "./dealflow-owner-decisions.schema.json",
  "schemaVersion": "dealflow.owner-decisions.v1",
  "packetStatus": "UNRESOLVED_FAIL_CLOSED",
  "signatureStatus": "NOT_SIGNED",
  "packetDigest": null,
  "decisionInventorySha256": "12d0d5780a28dd93696f17ed1e7177ed85460428c4c3b02e180cf68db9073b8d",
  "generatedFrom": {
    "sourceRegister": "dealflow-final-master-execution-20260716-final-r3/OWNER_DECISION_REGISTER.json",
    "sourceRegisterSha256": "a1abcdcfed44565587f4728612b97b6dfe81c4bbc9e7730c67a17669e3a8ca02",
    "controllingPlan": "dealflow-final-master-execution-20260716-final-r3/inputs/CONTROLLING_MASTER_PLAN.txt",
    "controllingPlanSha256": "22f787c57a3fbf00081db0a57ec0c3ebfcf1f28d8a939556cb3da069db969b37"
  },
  "candidateBinding": {
    "bindingType": "DETACHED_SIGNED_AUTHORITY_REQUIRED",
    "envelopeSchemaVersion": "dealflow.owner-decision-authority-envelope.v1",
    "templatePath": "config/authority/dealflow-owner-decisions.v1.json",
    "exactCandidateIdentityLocation": "DETACHED_AUTHORITY_ENVELOPE",
    "trackedTemplateCannotGrantAuthority": true,
    "trackedSuccessorRequiresNewDetachedAuthority": true
  },
  "planBinding": {
    "requirementCount": 53,
    "requirementIds": [
      "CORE-ADMIN-001",
      "CORE-AUTH-001",
      "CORE-CAMPAIGN-001",
      "CORE-FUNNEL-001",
      "CORE-ONBOARDING-001",
      "CORE-QUALITY-SCALE-001",
      "CORE-SECURITY-DATA-001",
      "CORE-UI-001",
      "PRIVACY-COMPLIANCE-001",
      "PVD-CONTENT-RIGHTS-001",
      "PVD-CREATIVE-001",
      "PVD-DELETE-001",
      "PVD-FOUNDATION-001",
      "PVD-GHL-001",
      "PVD-GHL-COMMUNICATION-SAFETY-001",
      "PVD-GOLDEN-001",
      "PVD-LEAD-OUTCOME-FEEDBACK-001",
      "PVD-LOCALIZATION-001",
      "PVD-META-001",
      "PVD-OPTIMIZER-001",
      "PVD-REPORT-001",
      "PVD-STRIPE-001",
      "PVD-TWILIO-001",
      "PVD-WHITELABEL-001",
      "REL-ALIASES-001",
      "REL-CANARY-001",
      "REL-CANARY-INGRESS-001",
      "REL-CAPABILITY-001",
      "REL-CUTOVER-001",
      "REL-DEPLOYMENT-001",
      "REL-DOMAINS-001",
      "REL-DRAIN-001",
      "REL-ENV-001",
      "REL-GOLDEN-001",
      "REL-GUARD-001",
      "REL-LEGACY-FUNNEL-MIGRATION-001",
      "REL-MIGRATION-001",
      "REL-MIGRATION-IMPACT-001",
      "REL-MONITOR-001",
      "REL-OBS-001",
      "REL-POST-ALIAS-GUARD-AND-RAMP-001",
      "REL-POST-MIGRATION-GUARD-001",
      "REL-PRE-ALIAS-001",
      "REL-PROD-TRUTH-001",
      "REL-RECOVERY-001",
      "REL-SEAL-001",
      "REL-SIGNED-PREREQUISITE-INDEX-001",
      "REL-SOURCE-001",
      "REL-SUPPLY-CHAIN-001",
      "REL-TRUST-001",
      "REL-WHOLE-SYSTEM-DR-001",
      "SEC-PRIVILEGED-TENANCY-001",
      "VISION-SUPPORT-001"
    ],
    "sortedRequirementIdsSha256": "8c6bf382bb5f7d0233ecb7edbf591167dad3c18f5f14206735d38f830f3c9bc4"
  },
  "globalPolicy": {
    "unresolvedBehavior": "APPLY_SAFE_DEFAULT_AND_BLOCK_EFFECT_OR_RELEASE",
    "environmentVariablesCannotGrantAuthority": true,
    "unsignedValuesCannotGrantAuthority": true,
    "providerCredentialsCannotGrantAuthority": true,
    "productionReleaseAuthorized": false
  },
  "counts": {
    "total": 43,
    "unresolved": 43,
    "approved": 0,
    "primary": 19,
    "privacy": 9,
    "importedDebt": 12,
    "experimentalScope": 2,
    "adminSecurity": 1
  },
  "decisions": [
    {
      "id": "OWNER-001",
      "category": "PRIMARY",
      "question": "Exact Stripe test and production product and price ownership",
      "source": "Controlling master plan section 5",
      "releaseBlocking": true,
      "status": "UNRESOLVED_SIGNED_DECISION_REQUIRED",
      "safeDefault": "FAIL_CLOSED",
      "selectedValue": null,
      "effectiveAt": null,
      "reviewAt": null,
      "approver": {
        "role": "UNASSIGNED",
        "identityRef": null,
        "approvedAt": null,
        "signatureRef": null
      },
      "affectedRequirementIds": [
        "PVD-STRIPE-001"
      ],
      "directlyAffectedLegacyKeys": [],
      "activationGates": [
        "SAFE_DEFAULT_ACTIVE",
        "RELEASE_BLOCKED_UNTIL_SIGNED_APPROVAL"
      ]
    },
    {
      "id": "OWNER-002",
      "category": "PRIMARY",
      "question": "Currency, tax, cadence, cancellation, grace, refund, dispute, chargeback, credit expiry, and failed-generation compensation policy",
      "source": "Controlling master plan section 5",
      "releaseBlocking": true,
      "status": "UNRESOLVED_SIGNED_DECISION_REQUIRED",
      "safeDefault": "FAIL_CLOSED",
      "selectedValue": null,
      "effectiveAt": null,
      "reviewAt": null,
      "approver": {
        "role": "UNASSIGNED",
        "identityRef": null,
        "approvedAt": null,
        "signatureRef": null
      },
      "affectedRequirementIds": [
        "PVD-STRIPE-001"
      ],
      "directlyAffectedLegacyKeys": [],
      "activationGates": [
        "SAFE_DEFAULT_ACTIVE",
        "RELEASE_BLOCKED_UNTIL_SIGNED_APPROVAL"
      ]
    },
    {
      "id": "OWNER-003",
      "category": "PRIMARY",
      "question": "GHL agency and Marketplace authority, snapshot, manifest, slots, and location ownership",
      "source": "Controlling master plan section 5",
      "releaseBlocking": true,
      "status": "UNRESOLVED_SIGNED_DECISION_REQUIRED",
      "safeDefault": "FAIL_CLOSED",
      "selectedValue": null,
      "effectiveAt": null,
      "reviewAt": null,
      "approver": {
        "role": "UNASSIGNED",
        "identityRef": null,
        "approvedAt": null,
        "signatureRef": null
      },
      "affectedRequirementIds": [
        "CORE-FUNNEL-001",
        "PVD-GHL-001",
        "PVD-GHL-COMMUNICATION-SAFETY-001",
        "PVD-GOLDEN-001",
        "REL-GOLDEN-001",
        "REL-LEGACY-FUNNEL-MIGRATION-001"
      ],
      "directlyAffectedLegacyKeys": [],
      "activationGates": [
        "SAFE_DEFAULT_ACTIVE",
        "RELEASE_BLOCKED_UNTIL_SIGNED_APPROVAL"
      ]
    },
    {
      "id": "OWNER-004",
      "category": "PRIMARY",
      "question": "GHL data ownership, export and portability, owned-versus-customer location behavior, and offboarding",
      "source": "Controlling master plan section 5",
      "releaseBlocking": true,
      "status": "UNRESOLVED_SIGNED_DECISION_REQUIRED",
      "safeDefault": "FAIL_CLOSED",
      "selectedValue": null,
      "effectiveAt": null,
      "reviewAt": null,
      "approver": {
        "role": "UNASSIGNED",
        "identityRef": null,
        "approvedAt": null,
        "signatureRef": null
      },
      "affectedRequirementIds": [
        "CORE-FUNNEL-001",
        "PVD-DELETE-001",
        "PVD-GHL-001",
        "PVD-GHL-COMMUNICATION-SAFETY-001",
        "REL-LEGACY-FUNNEL-MIGRATION-001"
      ],
      "directlyAffectedLegacyKeys": [],
      "activationGates": [
        "SAFE_DEFAULT_ACTIVE",
        "RELEASE_BLOCKED_UNTIL_SIGNED_APPROVAL"
      ]
    },
    {
      "id": "OWNER-005",
      "category": "PRIMARY",
      "question": "Fixed question-slot versus documented dynamic-label strategy",
      "source": "Controlling master plan section 5",
      "releaseBlocking": true,
      "status": "UNRESOLVED_SIGNED_DECISION_REQUIRED",
      "safeDefault": "fixed preinstalled GHL question slots",
      "selectedValue": null,
      "effectiveAt": null,
      "reviewAt": null,
      "approver": {
        "role": "UNASSIGNED",
        "identityRef": null,
        "approvedAt": null,
        "signatureRef": null
      },
      "affectedRequirementIds": [
        "CORE-ONBOARDING-001",
        "PVD-GHL-001",
        "PVD-GHL-COMMUNICATION-SAFETY-001",
        "PVD-LOCALIZATION-001"
      ],
      "directlyAffectedLegacyKeys": [],
      "activationGates": [
        "SAFE_DEFAULT_ACTIVE",
        "RELEASE_BLOCKED_UNTIL_SIGNED_APPROVAL"
      ]
    },
    {
      "id": "OWNER-006",
      "category": "PRIMARY",
      "question": "Meta app, accounts, Pages, Pixels, forms, scopes, and canary budget",
      "source": "Controlling master plan section 5",
      "releaseBlocking": true,
      "status": "UNRESOLVED_SIGNED_DECISION_REQUIRED",
      "safeDefault": "FAIL_CLOSED",
      "selectedValue": null,
      "effectiveAt": null,
      "reviewAt": null,
      "approver": {
        "role": "UNASSIGNED",
        "identityRef": null,
        "approvedAt": null,
        "signatureRef": null
      },
      "affectedRequirementIds": [
        "PVD-GOLDEN-001",
        "PVD-LEAD-OUTCOME-FEEDBACK-001",
        "PVD-META-001",
        "REL-GOLDEN-001"
      ],
      "directlyAffectedLegacyKeys": [],
      "activationGates": [
        "SAFE_DEFAULT_ACTIVE",
        "RELEASE_BLOCKED_UNTIL_SIGNED_APPROVAL"
      ]
    },
    {
      "id": "OWNER-007",
      "category": "PRIMARY",
      "question": "Optimizer policy, currencies, ceilings, cooldowns, kill switches, and escalation",
      "source": "Controlling master plan section 5",
      "releaseBlocking": true,
      "status": "UNRESOLVED_SIGNED_DECISION_REQUIRED",
      "safeDefault": "FAIL_CLOSED",
      "selectedValue": null,
      "effectiveAt": null,
      "reviewAt": null,
      "approver": {
        "role": "UNASSIGNED",
        "identityRef": null,
        "approvedAt": null,
        "signatureRef": null
      },
      "affectedRequirementIds": [
        "PVD-LEAD-OUTCOME-FEEDBACK-001",
        "PVD-OPTIMIZER-001",
        "PVD-REPORT-001"
      ],
      "directlyAffectedLegacyKeys": [],
      "activationGates": [
        "SAFE_DEFAULT_ACTIVE",
        "RELEASE_BLOCKED_UNTIL_SIGNED_APPROVAL"
      ]
    },
    {
      "id": "OWNER-008",
      "category": "PRIMARY",
      "question": "Creative-provider accounts and exact maximum test cost",
      "source": "Controlling master plan section 5",
      "releaseBlocking": true,
      "status": "UNRESOLVED_SIGNED_DECISION_REQUIRED",
      "safeDefault": "FAIL_CLOSED",
      "selectedValue": null,
      "effectiveAt": null,
      "reviewAt": null,
      "approver": {
        "role": "UNASSIGNED",
        "identityRef": null,
        "approvedAt": null,